{"id":"00000000-0000-4000-8000-000000000001","workflow_id":"00000000-0000-4000-8000-000000000002","project_id":"fixture","ordinal":1,"task_key":"fixture","title":"Fixture task","task_type":"development","state":"queued","route":"pending","execution_mode":"auto","version":1,"rag_query":"fixture","rag_backend":"pending","rag_hit_ids":[],"rag_max_score":0,"match_threshold":0.75,"review_influence_weight":0,"request_artifact":{"sha256":"aaaaaaaaaaaaaaaaaaaaaaaaaaaaaaaaaaaaaaaaaaaaaaaaaaaaaaaaaaaaaaaa","uri":"fixture:request","media_type":"text/plain","size_bytes":10},"created_by":"human:fixture","created_at":"2026-09-06T00:00:00Z","updated_at":"2026-09-06T00:00:00Z"}
